{
  "mode": "kp_horary",
  "schema": {
    "name": "kp-horary-data-packet",
    "version": "1.0",
    "schema_id": "kp-horary-data-packet/1.0"
  },
  "question": {
    "text": "KP frontend contract sample",
    "horary_number": 123,
    "focus_house": 7,
    "place_name": "上海市"
  },
  "time_and_location": {
    "question_local": "2026-08-12T16:00:00+08:00",
    "question_utc": "2026-08-12T08:00:00+00:00",
    "house_solution_utc": "2026-08-12T02:10:10.437767+00:00",
    "timezone": "Asia/Shanghai",
    "latitude": 31.2304,
    "longitude": 121.4737
  },
  "calculation_config": {
    "zodiac": "sidereal_krishnamurti",
    "ayanamsha": "Krishnamurti",
    "ayanamsha_degrees_at_question": 24.1319940020079,
    "house_system": "placidus",
    "node_mode": "mean",
    "planet_time_policy": "question_time",
    "house_time_policy": "number_selected_ascendant_with_question_time_planets",
    "number_longitude_policy": "segment_midpoint",
    "automatic_judgment": false
  },
  "horary_number": {
    "number": 123,
    "interval_start_longitude": 176.11111111111111,
    "interval_end_longitude": 177.88888888888889,
    "representative_longitude": 177.0,
    "interior_offset_degrees": 0.8888888888888857,
    "longitude": 177.0,
    "sign": "处女",
    "degree_text": "27°00'00\" 处女",
    "sign_lord": {
      "id": "MERCURY",
      "name": "水星"
    },
    "nakshatra": {
      "index": 14,
      "name": "Chitra",
      "name_zh": "质多罗",
      "lord": {
        "id": "MARS",
        "name": "火星"
      },
      "pada": 2,
      "start_longitude": 173.33333333333334,
      "end_longitude": 186.66666666666666
    },
    "sub_lord": {
      "id": "JUPITER",
      "name": "木星",
      "start_longitude": 176.11111111111111,
      "end_longitude": 177.88888888888889
    },
    "sub_sub_lord": {
      "id": "VENUS",
      "name": "金星",
      "start_longitude": 176.98518518518517,
      "end_longitude": 177.28148148148148
    }
  },
  "house_solution": {
    "target_ascendant": 177.0,
    "solved_ascendant": 176.99999996172514,
    "residual_degrees": 3.827486239060818e-08,
    "evaluations": 383,
    "search_window_days": 1.1
  },
  "angles": [
    {
      "id": "ASC",
      "name": "上升",
      "longitude": 176.99999996172514,
      "sign": "处女",
      "degree_text": "27°00'00\" 处女",
      "sign_lord": {
        "id": "MERCURY",
        "name": "水星"
      },
      "nakshatra": {
        "index": 14,
        "name": "Chitra",
        "name_zh": "质多罗",
        "lord": {
          "id": "MARS",
          "name": "火星"
        },
        "pada": 2,
        "start_longitude": 173.33333333333334,
        "end_longitude": 186.66666666666666
      },
      "sub_lord": {
        "id": "JUPITER",
        "name": "木星",
        "start_longitude": 176.11111111111111,
        "end_longitude": 177.88888888888889
      },
      "sub_sub_lord": {
        "id": "VENUS",
        "name": "金星",
        "start_longitude": 176.98518518518517,
        "end_longitude": 177.28148148148148
      }
    },
    {
      "id": "MC",
      "name": "天顶",
      "longitude": 88.62137391205226,
      "sign": "双子",
      "degree_text": "28°37'17\" 双子",
      "sign_lord": {
        "id": "MERCURY",
        "name": "水星"
      },
      "nakshatra": {
        "index": 7,
        "name": "Punarvasu",
        "name_zh": "颇勒古尼",
        "lord": {
          "id": "JUPITER",
          "name": "木星"
        },
        "pada": 3,
        "start_longitude": 80.0,
        "end_longitude": 93.33333333333333
      },
      "sub_lord": {
        "id": "VENUS",
        "name": "金星",
        "start_longitude": 86.55555555555556,
        "end_longitude": 88.77777777777777
      },
      "sub_sub_lord": {
        "id": "MERCURY",
        "name": "水星",
        "start_longitude": 88.33333333333333,
        "end_longitude": 88.64814814814815
      }
    },
    {
      "id": "DSC",
      "name": "下降",
      "longitude": 356.99999996172517,
      "sign": "双鱼",
      "degree_text": "27°00'00\" 双鱼",
      "sign_lord": {
        "id": "JUPITER",
        "name": "木星"
      },
      "nakshatra": {
        "index": 27,
        "name": "Revati",
        "name_zh": "哩伐底",
        "lord": {
          "id": "MERCURY",
          "name": "水星"
        },
        "pada": 4,
        "start_longitude": 346.6666666666667,
        "end_longitude": 360.0
      },
      "sub_lord": {
        "id": "JUPITER",
        "name": "木星",
        "start_longitude": 356.1111111111111,
        "end_longitude": 357.8888888888889
      },
      "sub_sub_lord": {
        "id": "VENUS",
        "name": "金星",
        "start_longitude": 356.9851851851852,
        "end_longitude": 357.2814814814815
      }
    },
    {
      "id": "IC",
      "name": "天底",
      "longitude": 268.62137391205226,
      "sign": "射手",
      "degree_text": "28°37'17\" 射手",
      "sign_lord": {
        "id": "JUPITER",
        "name": "木星"
      },
      "nakshatra": {
        "index": 21,
        "name": "Uttara Ashadha",
        "name_zh": "后阿沙陀",
        "lord": {
          "id": "SUN",
          "name": "太阳"
        },
        "pada": 1,
        "start_longitude": 266.6666666666667,
        "end_longitude": 280.0
      },
      "sub_lord": {
        "id": "MARS",
        "name": "火星",
        "start_longitude": 268.44444444444446,
        "end_longitude": 269.22222222222223
      },
      "sub_sub_lord": {
        "id": "JUPITER",
        "name": "木星",
        "start_longitude": 268.60648148148147,
        "end_longitude": 268.7101851851852
      }
    }
  ],
  "planets": [
    {
      "id": "SUN",
      "name": "太阳",
      "longitude": 115.51359506247775,
      "sign": "巨蟹",
      "degree_text": "25°30'49\" 巨蟹",
      "sign_lord": {
        "id": "MOON",
        "name": "月亮"
      },
      "nakshatra": {
        "index": 9,
        "name": "Ashlesha",
        "name_zh": "阿沙莱沙",
        "lord": {
          "id": "MERCURY",
          "name": "水星"
        },
        "pada": 3,
        "start_longitude": 106.66666666666667,
        "end_longitude": 120.0
      },
      "sub_lord": {
        "id": "RAHU",
        "name": "罗睺",
        "start_longitude": 114.11111111111111,
        "end_longitude": 116.11111111111111
      },
      "sub_sub_lord": {
        "id": "VENUS",
        "name": "金星",
        "start_longitude": 115.39444444444445,
        "end_longitude": 115.72777777777777
      },
      "house": 10,
      "latitude": 8.501025080921136e-05,
      "declination": 14.9242,
      "speed": 0.9601156239661952,
      "retrograde": false,
      "ephemeris": "Swiss Ephemeris"
    },
    {
      "id": "MOON",
      "name": "月亮",
      "longitude": 110.0982056156714,
      "sign": "巨蟹",
      "degree_text": "20°05'54\" 巨蟹",
      "sign_lord": {
        "id": "MOON",
        "name": "月亮"
      },
      "nakshatra": {
        "index": 9,
        "name": "Ashlesha",
        "name_zh": "阿沙莱沙",
        "lord": {
          "id": "MERCURY",
          "name": "水星"
        },
        "pada": 2,
        "start_longitude": 106.66666666666667,
        "end_longitude": 120.0
      },
      "sub_lord": {
        "id": "VENUS",
        "name": "金星",
        "start_longitude": 109.33333333333333,
        "end_longitude": 111.55555555555556
      },
      "sub_sub_lord": {
        "id": "MARS",
        "name": "火星",
        "start_longitude": 110.0,
        "end_longitude": 110.12962962962963
      },
      "house": 10,
      "latitude": 1.417940865315137,
      "declination": 17.9155,
      "speed": 14.528372353097891,
      "retrograde": false,
      "ephemeris": "Swiss Ephemeris"
    },
    {
      "id": "MARS",
      "name": "火星",
      "longitude": 66.51351457399268,
      "sign": "双子",
      "degree_text": "06°30'49\" 双子",
      "sign_lord": {
        "id": "MERCURY",
        "name": "水星"
      },
      "nakshatra": {
        "index": 5,
        "name": "Mrigashira",
        "name_zh": "密伽尸罗",
        "lord": {
          "id": "MARS",
          "name": "火星"
        },
        "pada": 4,
        "start_longitude": 53.333333333333336,
        "end_longitude": 66.66666666666667
      },
      "sub_lord": {
        "id": "MOON",
        "name": "月亮",
        "start_longitude": 65.55555555555556,
        "end_longitude": 66.66666666666667
      },
      "sub_sub_lord": {
        "id": "VENUS",
        "name": "金星",
        "start_longitude": 66.42592592592592,
        "end_longitude": 66.61111111111111
      },
      "house": 9,
      "latitude": 0.24877745413996435,
      "declination": 23.6852,
      "speed": 0.6615766798491862,
      "retrograde": false,
      "ephemeris": "Swiss Ephemeris"
    },
    {
      "id": "MERCURY",
      "name": "水星",
      "longitude": 100.27069398954369,
      "sign": "巨蟹",
      "degree_text": "10°16'14\" 巨蟹",
      "sign_lord": {
        "id": "MOON",
        "name": "月亮"
      },
      "nakshatra": {
        "index": 8,
        "name": "Pushya",
        "name_zh": "鬼宿",
        "lord": {
          "id": "SATURN",
          "name": "土星"
        },
        "pada": 3,
        "start_longitude": 93.33333333333333,
        "end_longitude": 106.66666666666667
      },
      "sub_lord": {
        "id": "VENUS",
        "name": "金星",
        "start_longitude": 98.11111111111111,
        "end_longitude": 100.33333333333333
      },
      "sub_sub_lord": {
        "id": "KETU",
        "name": "计都",
        "start_longitude": 100.20370370370371,
        "end_longitude": 100.33333333333333
      },
      "house": 10,
      "latitude": 0.531383867416468,
      "declination": 19.674,
      "speed": 1.748267027776219,
      "retrograde": false,
      "ephemeris": "Swiss Ephemeris"
    },
    {
      "id": "JUPITER",
      "name": "木星",
      "longitude": 105.32814866530963,
      "sign": "巨蟹",
      "degree_text": "15°19'41\" 巨蟹",
      "sign_lord": {
        "id": "MOON",
        "name": "月亮"
      },
      "nakshatra": {
        "index": 8,
        "name": "Pushya",
        "name_zh": "鬼宿",
        "lord": {
          "id": "SATURN",